subject,identifier,type,creator,title,volume,edition,publisher,year,format,ISBN,ISSN,ISMN,EAN/UPC,binding/price,language,country,date of publication,description,collective title,links,relation,rights,subject headings,connected titles,uniform title,frequency,wv number
004 Informatik,"URN:urn:nbn:de:gbv:28-rosdok_id00002579-7, URL:http://nbn-resolving.de/urn:nbn:de:gbv:28-rosdok_id00002579-7, URL:http://d-nb.info/1293658367/34, , IDN:1293658367",Online-Ressource,"Konieczek, Björn [Verfasser] ; Timmermann, Dirk [Gutachter] ; Kastner, Wolfgang [Gutachter]","Deterministische und interoperable Kommunikation mit dem Constrained Application Protocol / Björn Konieczek ; Gutachter: Dirk Timmermann, Wolfgang Kastner",,,Rostock : Universität Rostock,2019,Online-Ressource,,,,,,ger,XA-DE-MV,,,,,,lizenzfrei,,,,,"23,O07"
020 Bibliotheks- und Informationswissenschaft,"URN:urn:nbn:de:kobv:526-opus4-13551, URL:http://nbn-resolving.de/urn:nbn:de:kobv:526-opus4-13551, URL:http://d-nb.info/1224353250/34, URL:https://opus4.kobv.de/opus4-th-wildau/frontdoor/index/index/docId/1355, IDN:1224353250",Online-Ressource,"Heim, Kathrin [Verfasser] ; Lohrum, Stefan [Akademischer Betreuer] ; Keidel, Petra [Akademischer Betreuer]","Die Deduplizierung von bibliothekarischen Metadaten am Beispiel der Datenintegration eines Institutskatalogs in den Bibliotheksverbund IDS St.Gallen / Kathrin Heim ; Stefan Lohrum, Petra Keidel",,,Wildau : Technische Hochschule Wildau,2019,Online-Ressource,,,,,,ger,XA-DE-BB,,,,,,lizenzfrei,,,,,"21,O01"
330 Wirtschaft,"URN:urn:nbn:de:101:1-2019080711032249706218, URL:http://nbn-resolving.de/urn:nbn:de:101:1-2019080711032249706218, URL:http://d-nb.info/1192391217/34, URL:http://www.rfii.de/de/dokumente/, IDN:1192391217",Online-Ressource,Rat für Informationsinfrastrukturen,[Digital competencies – urgently needed!] ; Digitale Kompetenzen - dringend gesucht! : Empfehlungen zu Berufs- und Ausbildungsperspektiven für den Arbeitsmarkt Wissenschaft / Rat für Informationsinfrastrukturen,,,Göttingen : Rat für Informationsinfrastrukturen,2019,Online-Ressource,,,,,,ger,XA-DE-NI,,,,,,lizenzfrei,,,Digital competencies – urgently needed!,,"19,O09"
"000 Allgemeines, Wissenschaft ; 020 Bibliotheks- und Informationswissenschaft","URN:urn:nbn:de:kobv:11-110-18452/20612-1, URL:http://nbn-resolving.de/urn:nbn:de:kobv:11-110-18452/20612-1, URL:http://d-nb.info/1189069539/34, URL:http://edoc.hu-berlin.de/18452/20612, IDN:1189069539",Online-Ressource,"Petras, Vivien [Verfasser] ; Kindling, Maxi [Verfasser] ; Neuroth, Heike [Verfasser] ; Rothfritz, Laura [Verfasser]","Digitales Datenmanagement als Berufsfeld im Kontext der Data Literacy / Vivien Petras, Maxi Kindling, Heike Neuroth, Laura Rothfritz",,,Berlin : Humboldt-Universität zu Berlin,2019,Online-Ressource,,,,,,ger,XA-DE-BE,,,,,,lizenzfrei,,,,,"19,O07"
020 Bibliotheks- und Informationswissenschaft,"URN:urn:nbn:de:kobv:525-24636, URL:http://nbn-resolving.de/urn:nbn:de:kobv:525-24636, URL:http://d-nb.info/1203125720/34, URL:https://opus4.kobv.de/opus4-fhpotsdam/frontdoor/index/index/docId/2463, IDN:1203125720",Online-Ressource,"Neuroth, Heike [Verfasser] ; Rothfritz, Laura [Verfasser] ; Petras, Vivien [Verfasser] ; Kindling, Maxi [Verfasser]","Digitales Datenmanagement als neue Aufgabe für wissenschaftliche Bibliotheken / Heike Neuroth, Laura Rothfritz, Vivien Petras, Maxi Kindling",,,Potsdam : Fachhochschule Potsdam,2019,Online-Ressource,,,,,,ger,XA-DE-BB,,,,,,lizenzfrei,Datenmanagement ; Forschungsdaten ; Hochschulausbildung ; Open Science,,,,"20,O02"
004 Informatik,"URN:urn:nbn:de:bvb:473-opus4-551376, URL:http://nbn-resolving.de/urn:nbn:de:bvb:473-opus4-551376, URL:http://d-nb.info/126986601X/34, , ISSN:ISSN der Vorlage: 2750-8560, IDN:126986601X",Online-Ressource,"Kufer, Stefan [Verfasser] ; Henrich, Andreas [Gutachter]",Effective and Efficient Summarization of Two-Dimensional Point Data : Approaches for Resource Description and Selection in Spatial Application Scenarios / Stefan Kufer ; Gutachter: Andreas Henrich,,,Bamberg : University of Bamberg Press,2019,Online-Ressource,,,,,,eng,XA-DE-BY,,,Schriften aus der Fakultät Wirtschaftsinformatik und Angewandte Informatik der Otto-Friedrich-Universität Bamberg ; 38,,,lizenzfrei,Geoinformation ; Raumdaten ; Datenverwaltung ; Ähnlichkeitssuche ; Peer-to-Peer-Netz ; Abfrage ; Nächste-Nachbarn-Problem ; Mehrdimensionale Datenstruktur ; RDF &lt;Informatik>,Erscheint auch als: ISBN: 978-3-86309-672-4; Erscheint auch als: ISBN: 978-3-86309-673-1,,,"22,O11"
004 Informatik,"URN:urn:nbn:de:bsz:ch1-qucosa2-328172, URL:http://nbn-resolving.de/urn:nbn:de:bsz:ch1-qucosa2-328172, URL:http://d-nb.info/1215909284/34, , IDN:1215909284",Online-Ressource,"Morgenstern, Johannes [Verfasser] ; Benn, Wolfgang [Akademischer Betreuer] ; Benn, Wolfgang [Gutachter] ; Lehner, Wolfgang [Gutachter]","Einsatz des Intelligent Cluster Index in verteilten, dezentralen NoSQL-Systemen / Johannes Morgenstern ; Gutachter: Wolfgang Benn, Wolfgang Lehner ; Betreuer: Wolfgang Benn",,,Chemnitz : Technische Universität Chemnitz,2019,Online-Ressource,,,,,,ger,XA-DE-SN,,,,,,lizenzfrei,NoSQL-Datenbanksystem ; Massendaten ; Künstliche Intelligenz,,,,"20,O09"
"510 Mathematik ; 370 Erziehung, Schul- und Bildungswesen","URN:urn:nbn:de:101:1-2020071313444795134270, URL:http://nbn-resolving.de/urn:nbn:de:101:1-2020071313444795134270, URL:http://d-nb.info/1213678315/34, URL:https://publications.rwth-aachen.de/record/771553, IDN:1213678315",Online-Ressource,"Sube, Maike [Verfasser] ; Walcher, Sebastian [Akademischer Betreuer] ; Frank, Martin [Akademischer Betreuer]","Entwicklung und Evaluation von Unterrichtsmaterial zu Data Science und mathematischer Modellierung mit Schülerinnen und Schülern / Maike Sube ; Sebastian Walcher, Martin Frank",,,Aachen : Universitätsbibliothek der RWTH Aachen,2019,Online-Ressource,,,,,,ger,XA-DE-NW,,,,,,lizenzfrei,,,,,"20,O08"
330 Wirtschaft,"URN:urn:nbn:de:bvb:824-opus4-5217, URL:http://nbn-resolving.de/urn:nbn:de:bvb:824-opus4-5217, URL:http://d-nb.info/1200020251/34, URL:https://opus4.kobv.de/opus4-ku-eichstaett/frontdoor/index/index/docId/521, IDN:1200020251",Online-Ressource,"Buchwitz, Benjamin [Verfasser] ; Küsters, Ulrich [Akademischer Betreuer] ; Setzer, Thomas [Akademischer Betreuer]","Forecasting price decline events for consumer goods [cumulative dissertation] / Benjamin Buchwitz ; Ulrich Küsters, Thomas Setzer",,,Eichstätt-Ingolstadt : Katholische Universität Eichstätt-Ingolstadt,2019,Online-Ressource,,,,,,eng,XA-DE-BY,,,,,,lizenzfrei,Statistik ; Data Science ; Prognoseverfahren ; Big Data ; Electronic Commerce ; Data Science ; Big Data ; Statistik ; Electronic Commerce ; Prognoseverfahren ; Hochschulschrift,Erscheint auch als Benjamin Buchwitz: Forecasting price decline events for consumer goods,,,"19,O12"
"000 Allgemeines, Wissenschaft","URN:urn:nbn:de:101:1-2406051306097.708770330816, URL:http://nbn-resolving.de/urn:nbn:de:101:1-2406051306097.708770330816, URL:http://d-nb.info/1331724821/34, URL:https://mediastudies.hypotheses.org/1314, URL:https://mediarep.org/handle/doc/21479, ISSN:ISSN der Vorlage: 2629-6020, IDN:1331724821",Online-Ressource,"Einwächter, Sophie G. [Verfasser]",FORSCHUNGSDATEN (IN) DER FILM- UND MEDIENWISSENSCHAFT — Sophie G. Einwächter über vorurteilsbehaftete Begrifflichkeiten und fruchtbare Momente in der Lehre / Sophie G. Einwächter,,,Marburg : Philipps-Universität Marburg; Marburg : Sarah-Mai Dang; Marburg : Alena Strohmaier,2019,Online-Ressource,,,,,,ger,XA-DE-HE,,,,,,lizenzfrei,,,,,"24,O07"
"300 Sozialwissenschaften, Soziologie, Anthropologie","URN:urn:nbn:de:0168-ssoar-63409-0, URL:http://nbn-resolving.de/urn:nbn:de:0168-ssoar-63409-0, URL:http://d-nb.info/1200108973/34, URL:https://www.ssoar.info/ssoar/handle/document/63409, IDN:1200108973",Online-Ressource,"Dragon, Iris [Verfasser]","Forschungsdatenzentrum ""German Microdata Lab"": Service für amtliche Mikrodaten ; Jahresbericht 2018",,,Köln,2019,"Online-Ressource, 41 S.",,,,,,ger,XA-DE-BW,,,GESIS Papers ; Bd. 2019/11,,,,,,,,"19,O12"
004 Informatik,"URN:urn:nbn:de:101:1-2019021507215462167767, URL:http://nbn-resolving.de/urn:nbn:de:101:1-2019021507215462167767, URL:http://d-nb.info/1178125319/34, URL:http://www.che.de/downloads/CHE_AP_222_Handlungsempfehlung.pdf, ISBN:978-3-947793-17-4, ISSN:ISSN der Vorlage: 1862 - 7188, IDN:1178125319",Online-Ressource,"Roessler, Isabel Verfasser] ; Peksen, Sude [Verfasser] ; Friedrich, Julius-David [Verfasser] ; [Hachmeister, Cort-Denis [Verfasser] ; Nickel, Sigrun [Verfasser] ; Ulrich, Saskia [Verfasser]","Frauen in IT: Handlungsempfehlungen zur Gewinnung von Frauen für Informatik / Isabel Roessler, Sude Peksen, Julius-David Friedrich, Cort-Denis Hachmeister, Sigrun Nickel, Saskia Ulrich",,CHE AP222,Gütersloh : Centrum für Hochschulentwicklung gGmbH,2019,Online-Ressource,978-3-947793-17-4,,,,,ger,XA-DE-NW,,,,,,lizenzfrei,,,,,"19,O03"
004 Informatik,"URN:urn:nbn:de:kola-18906, URL:http://nbn-resolving.de/urn:nbn:de:kola-18906, URL:http://d-nb.info/1188612824/34, URL:https://kola.opus.hbz-nrw.de/frontdoor/index/index/docId/1890, IDN:1188612824",Online-Ressource,"Mader, Maximilian [Verfasser] ; Müller, Stefan [Gutachter] ; Keul, Kevin [Gutachter]","Hybrides Ray Tracing mit RTX-Technologie in Vulkan / Maximilian Mader ; Gutachter: Stefan Müller, Kevin Keul",,,Koblenz ; Landau : Universität Koblenz-Landau,2019,Online-Ressource,,,,,,ger,XA-DE-RP,,,,,,lizenzfrei,,,,,"19,O07"
650 Management,"URN:urn:nbn:de:bsz:289-oparu-19306-0, URL:http://nbn-resolving.de/urn:nbn:de:bsz:289-oparu-19306-0, URL:http://d-nb.info/1195606699/34, URL:http://nbn-resolving.de/urn:nbn:de:bsz:289-oparu-19306-0, IDN:1195606699",Online-Ressource,"Tiedeken, Julian [Verfasser]","Integration heterogener Produktdaten in verteilten, komplexen Entwicklungsprozessen / Julian Tiedeken",,,Ulm : Universität Ulm,2019,Online-Ressource,,,,,,ger,XA-DE-BW,,,,,,lizenzfrei,Produktdaten ; Datenintegration,,,,"19,O10"
004 Informatik,"URN:urn:nbn:de:hbz:464-20191004-091327-7, URL:http://nbn-resolving.de/urn:nbn:de:hbz:464-20191004-091327-7, URL:http://d-nb.info/1299597971/34, URL:https://duepublico2.uni-due.de/receive/duepublico_mods_00070571, ISBN:978-3-940402-24-0, IDN:1299597971",Online-Ressource,"Krämer, Nicole C. [Verfasser] ; Artelt, André [Verfasser] ; Geminn, Christian [Verfasser] ; Hammer, Barbara Verfasser] ; [Kopp, Stefan [Verfasser] ; Manzeschke, Arne [Verfasser] ; Roßnagel, Alexander [Verfasser] ; Slawik, Pauline Verfasser] ; [Szczuka, Jessica M. [Verfasser] ; Varonina, Lina Verfasser] ; [Weber, Carina [Verfasser]","KI-basierte Sprachassistenten im Alltag : Forschungsbedarf aus informatischer, psychologischer, ethischer und rechtlicher Sicht / Nicole Krämer, André Artelt, Christian Geminn, Barbara Hammer, Stefan Kopp, Arne Manzeschke, Alexander Rossnagel, Pauline Slawik, Jessica Szczuka, Lina Varonina, Carina Weber",,,"Essen : Universität Duisburg-Essen, Universitätsbibliothek",2019,Online-Ressource,978-3-940402-24-0,,,,,ger,XA-DE-NW,,,,,,lizenzfrei,,Weitere Ausg.: ISBN: 978-3-940402-24-0,,,"23,O09"
"621.3 Elektrotechnik, Elektronik","URN:urn:nbn:de:bsz:25-freidok-2200212, URL:http://nbn-resolving.de/urn:nbn:de:bsz:25-freidok-2200212, URL:http://d-nb.info/1243429690/34, URL:https://freidok.uni-freiburg.de/data/220021, IDN:1243429690",Online-Ressource,"Daum, Paul Philipp Quirin [Verfasser] ; Schutter, Jochem De Akademischer Betreuer] ; [Diehl, Moritz [Sonstige]","Modeling, identification, estimation and control of a rotational startup system for airborne wind energy",,,Freiburg : Universität,2019,Online-Ressource,,,,,,eng,XA-DE-BW,,,,,,lizenzfrei,Nichtlineare modellprädiktive Regelung ; Modellprädiktive Regelung ; Mathematische Modellierung ; Aerodynamik ; Optimale Kontrolle ; Experiment ; Periodischer Orbit ; Regelungstechnik ; Kontrolltheorie ; Digitale Signalverarbeitung,,,,"21,O11"
004 Informatik,"URN:urn:nbn:de:gbv:ilm1-mhb-14622, URL:http://nbn-resolving.de/urn:nbn:de:gbv:ilm1-mhb-14622, URL:http://d-nb.info/1194062946/34, URL:https://www.db-thueringen.de/receive/dbt_mods_00038725, IDN:1194062946",Online-Ressource,"Ilmenau, Rektor der Technischen Universität [Herausgeber]",Modulhandbuch Master Wirtschaftsinformatik : Studienordnungsversion: 2009 / Herausgeber: Rektor der Technischen Universität Ilmenau,,,Ilmenau : TU Ilmenau,2019,Online-Ressource,,,,,,ger,XA-DE-TH,,,"Modulhandbuch Master ; SO, 2009",,,lizenzfrei,,,,,"19,O10"
004 Informatik,"URN:urn:nbn:de:gbv:ilm1-mhb-16583, URL:http://nbn-resolving.de/urn:nbn:de:gbv:ilm1-mhb-16583, URL:http://d-nb.info/1201275326/34, URL:https://www.db-thueringen.de/receive/dbt_mods_00040126, IDN:1201275326",Online-Ressource,"Ilmenau, Rektor der Technischen Universität [Herausgeber]",Modulhandbuch Master Wirtschaftsinformatik : Studienordnungsversion: 2009 / Herausgeber: Rektor der Technischen Universität Ilmenau,,,Ilmenau : TU Ilmenau,2019,Online-Ressource,,,,,,ger,XA-DE-TH,,,"Modulhandbuch Master ; SO, 2009",,,lizenzfrei,,,,,"20,O01"
020 Bibliotheks- und Informationswissenschaft,"URN:urn:nbn:de:bsz:960-opus4-25728, URL:http://nbn-resolving.de/urn:nbn:de:bsz:960-opus4-25728, URL:http://d-nb.info/1288718314/34, URL:https://serwiss.bib.hs-hannover.de/frontdoor/index/index/docId/2572, IDN:1288718314",Online-Ressource,"Blümel, Ina [Verfasser] ; Drees, Bastian [Verfasser] ; Hauschke, Christian [Verfasser] ; Heller, Lambert [Verfasser] ; Tullney, Marco [Verfasser]","OPEN SCIENCE UND DIE BIBLIOTHEK - AKTIONSFELDER UND BERUFSBILD / Ina Blümel, Bastian Drees, Christian Hauschke, Lambert Heller, Marco Tullney",,,Hannover : Hochschule Hannover,2019,Online-Ressource,,,,,,ger,XA-DE-NI,,,,,,lizenzfrei,Berufsbild ; Forschungsdaten ; Wissenschaftliche Bibliothek ; Open Science ; Open Data ; Open Access,,,,"23,O06"
020 Bibliotheks- und Informationswissenschaft,"URN:urn:nbn:de:kobv:525-24657, URL:http://nbn-resolving.de/urn:nbn:de:kobv:525-24657, URL:http://d-nb.info/1204059691/34, URL:https://opus4.kobv.de/opus4-fhpotsdam/frontdoor/index/index/docId/2465, IDN:1204059691",Online-Ressource,"Wuttke, Ulrike [Verfasser] ; Spiecker, Claus [Verfasser] ; Neuroth, Heike [Verfasser]","PARTHENOS – Eine digitale Forschungsinfrastruktur für die Geistes- und Kulturwissenschaften / Ulrike Wuttke, Claus Spiecker, Heike Neuroth",,,Potsdam : Fachhochschule Potsdam,2019,Online-Ressource,,,,,,ger,XA-DE-BB,,,,,,lizenzfrei,Forschung ; Forschungsdaten ; Open Science ; Digital Humanities ; Kulturerbe,,,,"20,O03"
330 Wirtschaft,"URN:urn:nbn:de:101:1-2023090412304069349439, URL:http://nbn-resolving.de/urn:nbn:de:101:1-2023090412304069349439, URL:http://d-nb.info/1300921390/34, URL:https://www.acatech.de/publikation/pilotphase-nationales-kompetenz-monitoring/, ISSN:ISSN der Vorlage: 2193-8970, IDN:1300921390",Online-Ressource,"Gausemeier, Jürgen [Herausgeber] ; Guggemos, Michael [Herausgeber] ; Kreimeyer, Andreas [Herausgeber]","Pilotphase Nationales Kompetenz-Monitoring (NKM) Bericht: Data Science : Auswahl, Beschreibung, Bewertung und Messung der Schlüsselkompetenzen für das Technologiefeld Data Science / Herausgeber: Jürgen Gausemeier, Michael Guggemos, Andreas Kreimeyer",,,"München : acatech, Deutsche Akademie der Technikwissenschaften e.V.",2019,Online-Ressource,,,,,,ger,XA-DE-BY,,,acatech DISKUSSION,,,lizenzfrei,,,,,"23,O10"
340 Recht,"URN:urn:nbn:de:gbv:18-3-1951, URL:http://nbn-resolving.de/urn:nbn:de:gbv:18-3-1951, URL:http://d-nb.info/1190886502/34, URL:http://hup.sub.uni-hamburg.de/purl/HamburgUP_KreutzerLahmann_Rechtsfragen, IDN:1190886502",Online-Ressource,"Kreutzer, Till [Verfasser] ; Lahmann, Henning Christian [Verfasser]","Rechtsfragen bei Open Science : Ein Leitfaden / Till Kreutzer, Henning Lahmann",,,Hamburg : Hamburg University Press,2019,Online-Ressource,,,,,,ger,XA-DE-HH,,,,,,lizenzfrei,Deutschland ; Open Science ; Urheberrecht ; Forschungsdaten ; Persönlichkeitsrecht ; Datenschutz ; Haftung,Erscheint auch als: ISBN: 978-3-943423-67-9; Erscheint auch als Till Kreutzer: Rechtsfragen bei Open Science,,,"19,O08"
620 Ingenieurwissenschaften und Maschinenbau,"URN:urn:nbn:de:101:1-2019091906054142920415, URL:http://nbn-resolving.de/urn:nbn:de:101:1-2019091906054142920415, URL:http://d-nb.info/1195151047/34, URL:http://publications.rwth-aachen.de/record/762096, IDN:1195151047",Online-Ressource,"Konrad, Christian Verfasser] ; [Jacobs, Georg [Verfasser] ; Katzwinkel, Tim [Verfasser]","Sensordatenintegration in ein modellbasiertes Anforderungsmanagement / Christian Konrad, Georg Jacobs, Tim Katzwinkel",,,Aachen : Universitätsbibliothek der RWTH Aachen,2019,Online-Ressource,,,,,,ger,XA-DE-NW,,,,,,lizenzfrei,,,,,"19,O10"
004 Informatik,"URN:urn:nbn:de:bsz:ch1-qucosa2-361962, URL:http://nbn-resolving.de/urn:nbn:de:bsz:ch1-qucosa2-361962, URL:http://d-nb.info/1219582638/34, , IDN:1219582638",Online-Ressource,"Schwalbe, Karsten [Verfasser] ; Groh, Alexander [Verfasser] ; Hertwig, Frank [Verfasser] ; Scheunert, Ulrich [Verfasser]","Strategien zur Datenfusion beim Maschinellen Lernen / Karsten Schwalbe, Alexander Groh, Frank Hertwig, Ulrich Scheunert",,,Chemnitz : Technische Universität Chemnitz,2019,Online-Ressource,,,,,,ger,XA-DE-SN,,,,,,lizenzfrei,Maschinelles Lernen ; Datenfusion ; Neuronales Netz ; Support-Vektor-Maschine ; Zuverlässigkeit,,,,"20,O11"
"004 Informatik ; 370 Erziehung, Schul- und Bildungswesen","URN:urn:nbn:de:101:1-2020022802541611701577, URL:http://nbn-resolving.de/urn:nbn:de:101:1-2020022802541611701577, URL:http://d-nb.info/1205546170/34, URL:http://hdl.handle.net/2003/38777, IDN:1205546170",Online-Ressource,"Biehler, Rolf [Verfasser] ; Frischemeier, Daniel [Verfasser] ; Podworny, Susanne Verfasser] ; Wassong, Thomas [Verfasser] ; Schulte, Carsten [Verfasser] ; [Opel, Simone [Verfasser] ; Schlichtig, Michael [Verfasser]","Substantielle Digitale Bildung statt nur Anwendung digitaler Werkzeuge – Impulse aus einem Pilotprojekt zu Data Science in der Sekundarstufe / Rolf Biehler, Daniel Frischemeier, Susanne Podworny, Thomas Wassong, Carsten Schulte, Simone Opel, Michael Schlichtig",,,Dortmund : Universitätsbibliothek Dortmund,2019,Online-Ressource,,,,,,ger,XA-DE-NW,,,,,,lizenzfrei,,,,,"20,O03"
320 Politik,"URN:urn:nbn:de:bsz:93-opus-ds-107167, URL:http://nbn-resolving.de/urn:nbn:de:bsz:93-opus-ds-107167, URL:http://d-nb.info/1203626282/34, , IDN:1203626282",Online-Ressource,"Bauer, Christina [Verfasser]",Untersuchung der Durchführung der Offline Phase von MPC Protokollen / Christina Bauer,,,Stuttgart : Universitätsbibliothek der Universität Stuttgart,2019,Online-Ressource,,,,,,ger,XA-DE-BW,,,,,,lizenzfrei,,,,,"20,O02"
"791 Öffentliche Darbietungen, Film, Rundfunk","URN:urn:nbn:de:hbz:832-epub4-13950, URL:http://nbn-resolving.de/urn:nbn:de:hbz:832-epub4-13950, URL:http://d-nb.info/1194462154/34, URL:https://epb.bibl.th-koeln.de/frontdoor/index/index/docId/1395, IDN:1194462154",Online-Ressource,"Schinker, Kathrin [Verfasser] ; Faeskorn-Woyke, Heide [Gutachter]",Vergleich von Time Series Databases und Event Stores / Kathrin Schinker ; Gutachter: Heide Faeskorn-Woyke,,,Köln : Hochschulbibliothek der Technischen Hochschule Köln,2019,Online-Ressource,,,,,,ger,XA-DE-NW,,,,,,lizenzfrei,Datenbank ; Zeitreihe,,,,"19,O10"
004 Informatik,"URN:urn:nbn:de:kola-19028, URL:http://nbn-resolving.de/urn:nbn:de:kola-19028, URL:http://d-nb.info/1192756746/34, URL:https://kola.opus.hbz-nrw.de/frontdoor/index/index/docId/1902, IDN:1192756746",Online-Ressource,"Noll, Christoph [Verfasser] ; Hug, Alexander [Akademischer Betreuer] ; Müller, Stefan [Akademischer Betreuer]","Weiterentwicklung der Unterrichtsreihe Planspiel 2.0: „Wer weiß was über mich im Internet?“ des Projekts Informatik im Kontext und Durchführung dieser in einem Grundkurs Informatik / Christoph Noll ; Alexander Hug, Stefan Müller",,,Koblenz ; Landau : Universität Koblenz-Landau,2019,Online-Ressource,,,,,,ger,XA-DE-RP,,,,,,lizenzfrei,Informatik ; Datenschutz ; Unterricht,,,,"19,O09"
"000 Allgemeines, Wissenschaft","URN:urn:nbn:de:101:1-2020081207385699756151, URL:http://nbn-resolving.de/urn:nbn:de:101:1-2020081207385699756151, URL:http://d-nb.info/121576149X/34, URL:https://www.repo.uni-hannover.de/handle/123456789/4591, IDN:121576149X",Online-Ressource,"Heller, Lambert [Verfasser]","Wie Blockchain und Big Data Wissenschaftskommunikation, Informationsmärkte und digitale Teilhabe verändern / Lambert Heller",,,Hannover : Gottfried Wilhelm Leibniz Universität Hannover; Hannover : Technische Informationsbibliothek (TIB),2019,Online-Ressource,,,,,,ger,XA-DE-NI,,,,,,lizenzfrei,,,,,"20,O09"
004 Informatik,"URN:urn:nbn:de:bsz:753-opus4-7097, URL:http://nbn-resolving.de/urn:nbn:de:bsz:753-opus4-7097, URL:http://d-nb.info/1188317350/34, URL:https://hses.bsz-bw.de/frontdoor/index/index/docId/709, IDN:1188317350",Online-Ressource,"Hartung, Julia [Verfasser] ; Kuhn, Nico [Verfasser] ; Quell, Patrick [Verfasser] ; Wacker, Konstantin [Verfasser] ; Marchthaler, Reiner [Verfasser]","A matter of reality / Julia Hartung, Nico Kuhn, Patrick Quell, Konstantin Wacker, Reiner Marchthaler",,,Esslingen : Hochschule Esslingen,2018,Online-Ressource,,,,,,eng,XA-DE-BW,,,,,,lizenzfrei,Neuronales Netz ; Data Mining ; Data Science ; Virtuelle Realität,,,,"19,O07"
,"URN:urn:nbn:de:hbz:708-dh7284, URL:http://nbn-resolving.de/urn:nbn:de:hbz:708-dh7284, URL:http://d-nb.info/1156460662/34, URL:https://ub-deposit.fernuni-hagen.de/receive/mir_mods_00001225, IDN:1156460662",Online-Ressource,"Hehmann, Dietmar [Verfasser]",Adaptive Prozess- und Speicherverwaltung in verteilten Systemen / Dietmar Hehmann,,,Hagen : FernUniversität in Hagen,2018,Online-Ressource,,,,,,ger,XA-DE-NW,,,Informatik-Berichte ; 65.1987,,,lizenzfrei,,Erscheint auch als: Adaptive Prozess- und Speicherverwaltung in verteilten Systemen : Verfasser : 1987,,,"18,O05"
004 Informatik,"URN:urn:nbn:de:bsz:15-qucosa2-322044, URL:http://nbn-resolving.de/urn:nbn:de:bsz:15-qucosa2-322044, URL:http://d-nb.info/1246014793/34, , IDN:1246014793",Online-Ressource,"Rahm, Erhard [Verfasser]",Algorithmen und Datenstrukturen 1 / Erhard Rahm,,,Leipzig : Universität Leipzig; Leipzig : Universitätsbibliothek Leipzig,2018,Online-Ressource,,,,,,ger,XA-DE-SN,,,,,,lizenzfrei,,,,,"21,O12"
004 Informatik,"URN:urn:nbn:de:bsz:15-qucosa2-322027, URL:http://nbn-resolving.de/urn:nbn:de:bsz:15-qucosa2-322027, URL:http://d-nb.info/1246014769/34, , IDN:1246014769",Online-Ressource,"Rahm, Erhard [Verfasser]",Algorithmen und Datenstrukturen 2 / Erhard Rahm,,,Leipzig : Universität Leipzig; Leipzig : Universitätsbibliothek Leipzig,2018,Online-Ressource,,,,,,ger,XA-DE-SN,,,,,,lizenzfrei,,,,,"21,O12"
004 Informatik,"URN:urn:nbn:de:bsz:15-qucosa2-319163, URL:http://nbn-resolving.de/urn:nbn:de:bsz:15-qucosa2-319163, URL:http://d-nb.info/1245936565/34, , IDN:1245936565",Online-Ressource,"Stöhr, Thomas [Verfasser]",Analytische Bestimmung einer Datenallokation für Parallele Data Warehouses / Thomas Stöhr,,,Leipzig : Universitätsbibliothek Leipzig,2018,Online-Ressource,,,,,,ger,XA-DE-SN,,,,,,lizenzfrei,,,,,"21,O12"
,"URN:urn:nbn:de:hbz:708-dh7653, URL:http://nbn-resolving.de/urn:nbn:de:hbz:708-dh7653, URL:http://d-nb.info/1157122906/34, URL:https://ub-deposit.fernuni-hagen.de/receive/mir_mods_00001271, IDN:1157122906",Online-Ressource,"Rieskamp, Michael Verfasser] ; [Schlageter, Gunter [Verfasser]","Anfragesprachen für Netzwerk-Datenbanken / Michael Rieskamp, Gunter Schlageter",,,Hagen : FernUniversität in Hagen,2018,Online-Ressource,,,,,,ger,XA-DE-NW,,,Informatik-Berichte ; 38,,,lizenzfrei,Netzwerkdatenbanksystem ; Abfragesprache ; Datenbanksprache ; Deklarative Programmiersprache,Erscheint auch als: Anfragesprachen für Netzwerk-Datenbanken : Verfasser : 1983,,,"18,O06"
350 Öffentliche Verwaltung,"URN:urn:nbn:de:0168-ssoar-57539-3, URL:http://nbn-resolving.de/urn:nbn:de:0168-ssoar-57539-3, URL:http://d-nb.info/1191668118/34, URL:https://www.ssoar.info/ssoar/handle/document/57539, IDN:1191668118",Online-Ressource,"Mergel, Ines [Verfasser] ; Mohabbat Kar, Resa Herausgeber] ; [Thapa, Basanta [Herausgeber] ; Parycek, Peter [Herausgeber]",Big Data und Data-Science-Ansätze in der öffentlichen Verwaltung,,,Berlin,2018,"Online-Ressource, 76-96 S.",,,,,,ger,XA-DE-BW,,,(Un)berechenbar? Algorithmen und Automatisierung in Staat und Gesellschaft,,,,,,,,"19,O08"
"570 Biowissenschaften, Biologie","URN:urn:nbn:de:bsz:15-qucosa2-322074, URL:http://nbn-resolving.de/urn:nbn:de:bsz:15-qucosa2-322074, URL:http://d-nb.info/1246014823/34, , IDN:1246014823",Online-Ressource,"Sosna, Dieter [Verfasser]",Bio-Datenbanken / Dieter Sosna,,,Leipzig : Universität Leipzig; Leipzig : Universitätsbibliothek Leipzig,2018,Online-Ressource,,,,,,ger,XA-DE-SN,,,,,,lizenzfrei,,,,,"21,O12"
004 Informatik,"URN:urn:nbn:de:bsz:15-qucosa2-322050, URL:http://nbn-resolving.de/urn:nbn:de:bsz:15-qucosa2-322050, URL:http://d-nb.info/1246014785/34, , IDN:1246014785",Online-Ressource,"Rahm, Erhard [Verfasser]",Datenbanksysteme 2 : Vorlesungsskript Sommersemester 1999 / Erhard Rahm,,,Leipzig : Universität Leipzig; Leipzig : Universitätsbibliothek Leipzig,2018,Online-Ressource,,,,,,ger,XA-DE-SN,,,,,,lizenzfrei,,,,,"21,O12"
004 Informatik,"URN:urn:nbn:de:bsz:15-qucosa2-171648, URL:http://nbn-resolving.de/urn:nbn:de:bsz:15-qucosa2-171648, URL:http://d-nb.info/1245532251/34, , IDN:1245532251",Online-Ressource,"Liegl, Marion [Verfasser] ; Freiling, Felix C. [Akademischer Betreuer] ; Mink, Martin [Akademischer Betreuer] ; Sosna, Dieter [Akademischer Betreuer]","Datenschutz in computerforensischen Veranstaltungen / Marion Liegl ; Felix Freiling, Martin Mink, Dieter Sosna",,,Leipzig : Universitätsbibliothek Leipzig,2018,Online-Ressource,,,,,,ger,XA-DE-SN,,,Abschluss- und Qualifikationsarbeiten aus der Fakultät für Mathematik und Informatik,,,lizenzfrei,,,,,"21,O12"
