subject,identifier,type,creator,title,volume,edition,publisher,year,format,ISBN,ISSN,ISMN,EAN/UPC,binding/price,language,country,date of publication,description,collective title,links,relation,rights,subject headings,connected titles,uniform title,frequency,wv number
"570 Biowissenschaften, Biologie ; 004 Informatik","URN:urn:nbn:de:0001-00457, URL:http://nbn-resolving.de/urn:nbn:de:0001-00457, URL:http://d-nb.info/989987981/34, URL:http://www.fz-juelich.de/nic-series/volume40/, ISBN:978-3-9810843-6-8, IDN:989987981",Online-Ressource,"Hansmann, Ulrich H. E. [Mitwirkender] ; Meinke, Jan H. [Mitwirkender] ; Mohanty, Sandipan [Mitwirkender] ; Nadler, Walter [Mitwirkender] ; Zimmermann, Olav [Mitwirkender]","From computational biophysics to systems biology : proceedings / (CBSB08), symposium, 19. - 21. May 2008, Forschungszentrum Jülich. John von Neumann Institute for Computing (NIC). Ed. by Ulrich H. E. Hansmann ...",,,Jülich : NIC,2008,Online-Ressource,978-3-9810843-6-8,,,,,eng,XA-DE-NW,,,John von Neumann-Institut für Computing: NIC series : Verfasser ; Vol. 40,,http://d-nb.info/986551945,lizenzfrei,Biologie ; Biowissenschaften ; Datenverarbeitung ; Computerunterstütztes Verfahren,Erscheint auch als: From computational biophysics to systems biology : 2008,,,"08,B36,0467"
500 Naturwissenschaften,"URN:urn:nbn:de:bsz:25-opus-1738, URL:http://nbn-resolving.de/urn:nbn:de:bsz:25-opus-1738, URL:http://d-nb.info/1114828505/34, URL:https://www.freidok.uni-freiburg.de/data/173, IDN:1114828505",Online-Ressource,"Reimers, Frank [Verfasser]",Naturwissenschaften - Literatursuche elektronisch in Freiburg,,,Freiburg : Universität,2008,Online-Ressource,,,,,,ger,XA-DE-BW,,,,,,lizenzfrei,Naturwissenschaften ; Biologie ; Chemie ; Literaturdatenbank ; Online-Literaturrecherche ; Online-Ressource,,,,"16,O10"
"004 Informatik ; 620 Ingenieurwissenschaften und Maschinenbau ; 380 Handel, Kommunikation, Verkehr","URN:urn:nbn:de:bvb:19-93483, URL:http://nbn-resolving.de/urn:nbn:de:bvb:19-93483, URL:http://d-nb.info/991830024/34, URL:http://edoc.ub.uni-muenchen.de/9348/1/Fuchs_Florian.pdf, URL:http://edoc.ub.uni-muenchen.de/9348/, IDN:991830024",Online-Ressource,"Fuchs, Florian [Verfasser]",Semantische Modellierung und Reasoning für Kontextinformationen in Infrastrukturnetzen / Florian Fuchs,,,,2008,Online-Ressource,,,,,,ger,XA-DE,,"München, Univ., Diss., 2008",,,,lizenzfrei,Ambient Intelligence ; Kontextbezogenes System ; Fernüberwachung ; Ontologie &lt;Wissensverarbeitung> ; Terminologische Logik ; Versorgungsnetz; Eisenbahnnetz ; Zustandsüberwachung ; Kontextbezogenes System ; Ontologie &lt;Wissensverarbeitung> ; Geodateninfrastruktur ; Semantic Web,,,,"09,H09,0080"
"570 Biowissenschaften, Biologie ; 004 Informatik","URN:urn:nbn:de:hebis:77-21589, URL:http://nbn-resolving.de/urn:nbn:de:hebis:77-21589, URL:http://d-nb.info/100073773X/34, URL:http://ubm.opus.hbz-nrw.de/volltexte/2009/2158/, IDN:100073773X",Online-Ressource,"Wiebringhaus, Thomas [Verfasser]",Topological aspects of the human protein interaction network / Thomas Wiebringhaus,,[Online-Ausg.],,2008,112 S. : graph. Darst. ; 30 cm,,,,,,eng,XA-DE,,"Mainz, Univ., Diss., 2009",,,,lizenzfrei,Proteine ; Neuronales Netz ; Datenverarbeitung ; Computerunterstütztes Verfahren,"Online-Ausg.: [2009]. Online-Ressource, Erscheint auch als Thomas Wiebringhaus: Topological aspects of the human protein interaction network",,,"10,O03"
004 Informatik,"URN:urn:nbn:de:101:1-2021080614050948932921, URL:http://nbn-resolving.de/urn:nbn:de:101:1-2021080614050948932921, URL:http://d-nb.info/1238393357/34, URL:https://mediarep.org/handle/doc/13236, IDN:1238393357",Online-Ressource,"Hellige, Hans Dieter [Verfasser] ; Hellige, Hans Dieter [Herausgeber]",Vorwort / Hans Dieter Hellige ; Herausgeber: Hans Dieter Hellige,,,Marburg : Philipps-Universität Marburg; Bielefeld : transcript,2008,Online-Ressource,,,,,,ger,XA-DE-HE,,,,,,lizenzfrei,,,,,"21,O09"
"570 Biowissenschaften, Biologie","URN:urn:nbn:de:bvb:29-opus-6135, URL:http://nbn-resolving.de/urn:nbn:de:bvb:29-opus-6135, URL:http://d-nb.info/984307923/34, URL:http://www.opus.ub.uni-erlangen.de/opus/volltexte/2007/613/pdf/MartinReitzDissertation.pdf, URL:http://www.opus.ub.uni-erlangen.de/opus/volltexte/2007/613/index.html, IDN:984307923",Online-Ressource,"Reitz, Martin Johann [Verfasser]",Classification of metabolic reactions based on physicochemical properties and search for enzyme inhibitors / vorgelegt von Martin Johann Reitz,,,,2007,Online-Ressource,,,,,,eng,XA-DE,,"Erlangen, Nürnberg, Univ., Diss., 2007",,,,lizenzfrei,Enzyminhibitor ; Enzym ; Moleküldeskriptor ; Deskriptor ; Biologie ; Biowissenschaften ; Datenverarbeitung ; Computerunterstütztes Verfahren,Erscheint auch als Martin Johann Reitz: Classification of metabolic reactions based on physicochemical properties and search for enzyme inhibitors,,,"07,H07,1072"
"570 Biowissenschaften, Biologie","URN:urn:nbn:de:hbz:061-20080123-113151-2, URL:http://nbn-resolving.de/urn:nbn:de:hbz:061-20080123-113151-2, URL:http://d-nb.info/98753212X/34, URL:http://docserv.uni-duesseldorf.de/servlets/DerivateServlet/Derivate-6930/Dissertation_Paulsen_PDFA.pdf, IDN:98753212X",Online-Ressource,"Paulsen, Ingo [Verfasser]",Collaborative knowledge management in the life sciences network / vorgelegt von Ingo Paulsen,,,,2007,Online-Ressource,,,,,,eng,XA-DE,,"Düsseldorf, Univ., Diss., 2008",,,,lizenzfrei,Biologie ; Biowissenschaften ; Wissensbasiertes System ; Datenverarbeitung ; Computerunterstütztes Verfahren,Erscheint auch als Ingo Paulsen: Collaborative knowledge manegement in the life sciences network,,,"08,H06,1172"
004 Informatik,"URN:urn:nbn:de:bsz:291-scidok-12690, URL:http://nbn-resolving.de/urn:nbn:de:bsz:291-scidok-12690, URL:http://d-nb.info/985570113/34, URL:http://scidok.sulb.uni-saarland.de/volltexte/2007/1269/pdf/Dissertation_4103_Theo_Anja_2004.pdf, URL:http://scidok.sulb.uni-saarland.de/volltexte/2007/1269/, IDN:985570113",Online-Ressource,"Theobald, Anja [Verfasser]",Die XXL-Suchmaschine zur ontologiebasierten Ähnlichkeitssuche in XML-Dokumenten / Anja Theobald,,,,2007,Online-Ressource,,,,,,ger,XA-DE,,"Saarbrücken, Univ., Diss., 2004",,,,lizenzfrei,World Wide Web ; Suchmaschine ; XML ; Abfragesprache ; Benchmark; XML ; Semistrukturierte Daten ; Gerichteter Graph ; Ähnlichkeitssuche ; Ontologie &lt;Wissensverarbeitung> ; Vektorraummodell,Erscheint auch als: Die XXL-Suchmaschine zur ontologiebasierten Ähnlichkeitssuche in XML-Dokumenten : Verfasser,,,"08,H02,0098"
"570 Biowissenschaften, Biologie","URN:urn:nbn:de:hbz:38-22294, URL:http://nbn-resolving.de/urn:nbn:de:hbz:38-22294, URL:http://d-nb.info/987491423/34, URL:http://kups.ub.uni-koeln.de/volltexte/2008/2229/pdf/Entwicklung_einer_Textminingmethode_zur_automatisierten_Extraktion_von_kinetischen_Informationen_aus_der_Literatur_Stephanie_Heinen.pdf, URL:http://kups.ub.uni-koeln.de/volltexte/2008/2229/index.html, IDN:987491423",Online-Ressource,"Heinen, Stephanie Eva [Verfasser]",Entwicklung einer Textminingmethode zur automatisierten Extraktion von kinetischen Informationen aus der Literatur / vorgelegt von Stephanie Eva Heinen,,,,2007,Online-Ressource,,,,,,ger,XA-DE,,"Köln, Univ., Diss., 2007",,,,lizenzfrei,Biologie ; Biowissenschaften ; Datenverwaltung ; Dateiverwaltung ; Datei ; Datenbankverwaltung ; Datenverarbeitung ; Computerunterstütztes Verfahren,Erscheint auch als Stephanie Eva Heinen: Entwicklung einer Textminingmethode zur automatisierten Extraktion von kinetischen Informationen aus der Literatur,,,"08,H05,1482"
510 Mathematik ; 004 Informatik ; 620 Ingenieurwissenschaften und Maschinenbau,"URN:urn:nbn:de:hbz:466-20080213013, URL:http://nbn-resolving.de/urn:nbn:de:hbz:466-20080213013, URL:http://d-nb.info/1033310220/34, URL:http://digital.ub.uni-paderborn.de/urn/urn:nbn:de:hbz:466-20080213013, IDN:1033310220",Online-Ressource,"Eickhoff, Ralf [Verfasser]",Fehlertolerante neuronale Netze zur Approximation von Funktionen / Ralf Eickhoff,,,Paderborn : Universitätsbibliothek,2007,Online-Ressource,,,,,,ger,XA-DE-NW,,"Paderborn, Universität, Diss., 2007",,,,lizenzfrei,Neuronales Netz ; Datenverarbeitung ; Computerunterstütztes Verfahren,,,,"13,O05"
"570 Biowissenschaften, Biologie","URN:urn:nbn:de:gbv:18-33022, URL:http://nbn-resolving.de/urn:nbn:de:gbv:18-33022, URL:http://d-nb.info/984383964/34, URL:http://www.sub.uni-hamburg.de/opus/volltexte/2007/3302/pdf/dissertation_boris_kroeplien.pdf, URL:http://www.sub.uni-hamburg.de/opus/volltexte/2007/3302/index.html, IDN:984383964",Online-Ressource,"Kröplien, Boris [Verfasser]",Fragmentbasierte Entwicklung neuer Leitstrukturen in silico durch Integration von 3D-Pharmakophorhypothesen / vorgelegt von Boris Kröplien,,,,2007,Online-Ressource,,,,,,ger,XA-DE,,"Hamburg, Univ., Diss., 2007",,,,lizenzfrei,Computational chemistry ; HIV ; HIV Envelope Protein gp120 ; Antigen CD4 ; Docking ; Datenbank ; Konformation ; Molekulardesign ; Biologie ; Biowissenschaften ; Datenverarbeitung ; Computerunterstütztes Verfahren,,,,"07,H07,1081"
"570 Biowissenschaften, Biologie ; 004 Informatik","URN:urn:nbn:de:0001-00422, URL:http://nbn-resolving.de/urn:nbn:de:0001-00422, URL:http://d-nb.info/986551732/34, URL:http://www.fz-juelich.de/nic-series/volume36/nic-series-volume36.pdf, ISBN:978-3-9810843-2-0, IDN:986551732",Online-Ressource,"Hansmann, Ulrich H. E. [Mitwirkender]","From computational biophysics to systems biology : celebrating 20 years of NIC ; proceedings / (CBSB07), symposium, 02. - 04. May 2007, Forschungszentrum Jülich ... Ed. by Ulrich H. E. Hansmann ...",,,Jülich : NIC,2007,Online-Ressource,978-3-9810843-2-0,,,,,eng,XA-DE,,,John von Neumann-Institut für Computing: NIC series : Verfasser ; Vol. 36,,http://d-nb.info/986551945,lizenzfrei,Biologie ; Biowissenschaften ; Datenverarbeitung ; Computerunterstütztes Verfahren,Erscheint auch als: From computational biophysics to systems biology : 2007,,,"08,B01,0275"
004 Informatik,"URN:urn:nbn:de:bsz:93-opus-29911, URL:http://nbn-resolving.de/urn:nbn:de:bsz:93-opus-29911, URL:http://d-nb.info/1047337045/34, URL:http://elib.uni-stuttgart.de/opus/volltexte/2007/2991/, IDN:1047337045",Online-Ressource,"Pirk, Tobias [Verfasser]",Kontinuierliche Anfragen auf räumlichen Datenströmen unter Verwendung von XXL-Pipes / Tobias Pirk,,,Stuttgart : Universitätsbibliothek der Universität Stuttgart,2007,Online-Ressource,,,,,,ger,XA-DE-BW,,"Stuttgart, Universität Stuttgart, Diplomarbeit",,,,lizenzfrei,Datenstrom ; Lokalisation,,,,"14,O03"
"370 Erziehung, Schul- und Bildungswesen","URN:urn:nbn:de:hebis:26-opus-39955, URL:http://nbn-resolving.de/urn:nbn:de:hebis:26-opus-39955, URL:http://d-nb.info/1058185063/34, URL:http://geb.uni-giessen.de/geb/volltexte/2007/3995/, IDN:1058185063",Online-Ressource,"Ostheimer, Bernhard [Verfasser] ; Freisler, Peter [Verfasser]",Konzeption und Realisierung einer WBT-Serie zu datenbankgestützten dynamischen Web Sites mit PHP und MySQL / Bernhard; Ostheimer ; Peter Freisler,,,Gießen : Universitätsbibliothek,2007,Online-Ressource,,,,,,ger,XA-DE-HE,,,Arbeitspapiere Wirtschaftsinformatik ; 07 / 2006,,,lizenzfrei,,,,,"14,O10"
550 Geowissenschaften,"URN:urn:nbn:de:bsz:14-ds-1216743181586-50169, URL:http://nbn-resolving.de/urn:nbn:de:bsz:14-ds-1216743181586-50169, URL:http://d-nb.info/1000820416/34, URL:http://www.qucosa.de/recherche/frontdoor/?tx_slubopus4frontend[id, IDN:1000820416",Online-Ressource,"Peters, Ronny [Verfasser]","Künstliche neuronale Netze zur Beschreibung der hydrodynamischen Prozesse für den Hochwasserfall unter Berücksichtigung der Niederschlags-Abflu-Prozesse im Zwischeneinzugsgebiet / Ronny Peters. . Technische Universität Dresden, Institut für Hydrologie und Meteorologie, Lehrstuhl für Hydrologie",,[Online-Ausg.],"Dresden : IHM, Lehrstuhl Hydrologie",2007,"126 S. : Ill., graph. Darst., Kt. ; 25 cm",,,,,,ger,XA-DE,,"Zugl.: Dresden, Techn. Univ., Diss., 2007",Dresdner Schriften zur Hydrologie ; H. 7,,http://d-nb.info/026177730,lizenzfrei,Überschwemmung ; Neuronales Netz ; Datenverarbeitung ; Computerunterstütztes Verfahren,"Online-Ausg.: [Dresden] : [Sächsische Landebibliothek] 2008. Online-Ressource, Erscheint auch als Ronny Peters: Künstliche neuronale Netze zur Beschreibung der hydrodynamischen Prozesse für den Hochwasserfall unter Berücksichtigung der Niederschlags-Abfluss-Prozesse im Zwischeneinzugsgebiet",,,"10,O03"
550 Geowissenschaften,"URN:urn:nbn:de:swb:14-1175614939296-54836, URL:http://nbn-resolving.de/urn:nbn:de:swb:14-1175614939296-54836, URL:http://d-nb.info/984339930/34, URL:http://hsss.slub-dresden.de/documents/1175614939296-5483/1175614939296-5483.pdf, URL:http://hsss.slub-dresden.de/deds-access/hsss.urlmapping.MappingServlet?id=1175614939296-5483, IDN:984339930",Online-Ressource,"Cullmann, Johannes [Verfasser]",Online flood forecasting in fast responding catchments on the basis of a synthesis of artificial neural networks and process models / Johannes Cullmann,,,,2007,Online-Ressource,,,,,,eng,XA-DE,,"Dresden, Techn. Univ., Diss., 2007",,,,lizenzfrei,Hochwasservorhersage ; Neuronales Netz ; Überschwemmung ; Neuronales Netz ; Datenverarbeitung ; Computerunterstütztes Verfahren,,,,"07,H07,1044"
004 Informatik,"URN:urn:nbn:de:bsz:93-opus-33773, URL:http://nbn-resolving.de/urn:nbn:de:bsz:93-opus-33773, URL:http://d-nb.info/1056909862/34, URL:http://elib.uni-stuttgart.de/opus/volltexte/2007/3377/, IDN:1056909862",Online-Ressource,"Dick, Björn [Verfasser]",Organisation multidimensionaler Wellenausbreitungsdaten auf Festplatte für effizienten Lesezugriff / Björn Dick,,,Stuttgart : Universitätsbibliothek der Universität Stuttgart,2007,Online-Ressource,,,,,,ger,XA-DE-BW,,,,,,lizenzfrei,Festplatte ; Datenkompression ; Datenorganisation,,,,"14,O09"
"570 Biowissenschaften, Biologie","URN:urn:nbn:de:kobv:83-opus-15740, URL:http://nbn-resolving.de/urn:nbn:de:kobv:83-opus-15740, URL:http://d-nb.info/984663509/34, URL:http://opus.kobv.de/tuberlin/volltexte/2007/1574/pdf/morgenthal_katja.pdf, URL:http://opus.kobv.de/tuberlin/volltexte/2007/1574/, IDN:984663509",Online-Ressource,"Morgenthal, Katja [Verfasser]",Protein profiling und Metabolite profiling in Arabidopsis thaliana im systembiologischen Kontext / vorgelegt von Katja Morgenthal,,,,2007,Online-Ressource,,,,,,ger,XA-DE,,"Berlin, Techn. Univ., Diss., 2006",,,,lizenzfrei,Biochemische Analyse ; Ackerschmalwand ; Kapernartige ; Neuronales Netz ; Datenverarbeitung ; Computerunterstütztes Verfahren,,,,"07,H11,1208"
660 Technische Chemie ; 670 Industrielle und handwerkliche Fertigung,"URN:urn:nbn:de:hbz:82-opus-19861, URL:http://nbn-resolving.de/urn:nbn:de:hbz:82-opus-19861, URL:http://d-nb.info/985610697/34, URL:http://darwin.bth.rwth-aachen.de/opus3/volltexte/2007/1986/pdf/Doeren_Jens.pdf, URL:http://darwin.bth.rwth-aachen.de/opus3/volltexte/2007/1986/, IDN:985610697",Online-Ressource,"Dören, Jens [Verfasser]",Qualitätsmanagement und Neuronale Netze : ein Ansatz zur prädiktiven Regelung thermischer Spritzprozesse / vorgelegt von Jens Dören,,,,2007,Online-Ressource,,,,,,ger,XA-DE,,"Aachen, Techn. Hochsch., Diss., 2007",,,,lizenzfrei,Neuronales Netz ; Thermisches Spritzen ; Regler ; Reglerentwurf ; Beschichtung ; Beschichtungsanlage ; Neuronales Netz ; Datenverarbeitung ; Computerunterstütztes Verfahren ; Metallspritzen ; Metallisieren,Erscheint auch als Jens Dören: Qualitätsmanagement und neuronale Netze,,,"07,H12,3194"
004 Informatik,"URN:urn:nbn:de:0072-57070, URL:http://nbn-resolving.de/urn:nbn:de:0072-57070, URL:http://d-nb.info/983197105/34, URL:http://www.uvka.de/univerlag/volltexte/2007/195/, ISBN:978-3-86644-100-2 (kostenfrei), IDN:983197105",Online-Ressource,"Haase, Peter [Verfasser]",Semantic technologies for distributed information systems / by Peter Haase,,,Karlsruhe : Univ.-Verl. Karlsruhe,2007,Online-Ressource,978-3-86644-100-2,,,,(kostenfrei),eng,,,"Zugl.: Karlsruhe, Univ., Diss., 2006",,,,lizenzfrei,Ontologie &lt;Wissensverarbeitung> ; Verteiltes System ; Informationssystem,,,,"07,A31,0049"
004 Informatik,"URN:urn:nbn:de:hbz:6-79589449759, URL:http://nbn-resolving.de/urn:nbn:de:hbz:6-79589449759, URL:http://d-nb.info/1139643045/34, URL:http://nbn-resolving.de/urn:nbn:de:hbz:6-79589449759, IDN:1139643045",Online-Ressource,"Frieler, Dieter [Verfasser]",Sichere WLANs an UNI und UKM – 2007 / Dieter Frieler,,,Münster : Universitäts- und Landesbibliothek Münster,2007,Online-Ressource,,,,,,ger,XA-DE-NW,,,,,,lizenzfrei,,,,,"17,O10"
004 Informatik,"URN:urn:nbn:de:bsz:93-opus-30845, URL:http://nbn-resolving.de/urn:nbn:de:bsz:93-opus-30845, URL:http://d-nb.info/1056909757/34, URL:http://elib.uni-stuttgart.de/opus/volltexte/2007/3084/, IDN:1056909757",Online-Ressource,"Zhang, Jin [Verfasser]",Visualisierung von RoboCup-Kommunikationslogs / Jin Zhang,,,Stuttgart : Universitätsbibliothek der Universität Stuttgart,2007,Online-Ressource,,,,,,ger,XA-DE-BW,,,,,,lizenzfrei,Wissensrepräsentation ; Informationsverarbeitung ; Visualisierung,,,,"14,O09"
"570 Biowissenschaften, Biologie","URN:urn:nbn:de:hbz:82-opus-15276, URL:http://nbn-resolving.de/urn:nbn:de:hbz:82-opus-15276, URL:http://d-nb.info/980172764/34, URL:http://darwin.bth.rwth-aachen.de/opus/volltexte/2006/1527/pdf/Bongartz_Dirk.pdf, URL:http://darwin.bth.rwth-aachen.de/opus/volltexte/2006/1527/index.html, IDN:980172764",Online-Ressource,"Bongartz, Dirk [Verfasser]",Algorithmic aspects of some combinatorial problems in bioinformatics / vorgelegt von Dirk Bongartz,,,,2006,Online-Ressource,,,,,,eng,,,"Aachen, Techn. Hochsch., Diss., 2006",,,,lizenzfrei,Biologie ; Biowissenschaften ; Datenverwaltung ; Dateiverwaltung ; Datei ; Datenbankverwaltung ; Datenverarbeitung ; Computerunterstütztes Verfahren,Erscheint auch als Dirk Bongartz: Algorithmic aspects of some combinatorial problems in bioinformatics,,,"06,H09,0969"
"570 Biowissenschaften, Biologie","URN:urn:nbn:de:kobv:517-opus-7839, URL:http://nbn-resolving.de/urn:nbn:de:kobv:517-opus-7839, URL:http://d-nb.info/980988799/34, URL:http://opus.kobv.de/ubp/volltexte/2006/783/pdf/scholz_diss.pdf, URL:http://opus.kobv.de/ubp/volltexte/2006/783/index.html, IDN:980988799",Online-Ressource,"Scholz, Matthias [Verfasser]",Approaches to analyse and interpret biological profile data / von Matthias Scholz,,,,2006,Online-Ressource,,,,,,eng,,,"Potsdam, Univ., Diss., 2006",,,,lizenzfrei,Bioinformatik ; Hauptkomponentenanalyse ; Unabhängige Komponentenanalyse ; Neuronales Netz ; Maschinelles Lernen ; Fehlende Daten ; Ackerschmalwand ; Molekularbiologie ; Molekulargenetik ; Cytogenetik ; Neuronales Netz ; Datenverarbeitung ; Computerunterstütztes Verfahren,Erscheint auch als: Approaches to analyse and interpret biological profile data : Verfasser,,,"06,H11,0983"
"570 Biowissenschaften, Biologie","URN:urn:nbn:de:gbv:084-10484, URL:http://nbn-resolving.de/urn:nbn:de:gbv:084-10484, URL:http://d-nb.info/980738539/34, URL:http://bib1lp1.rz.tu-bs.de/docportal/servlets/MCRZipServlet?id=DocPortal_derivate_00002950, URL:http://www.digibib.tu-bs.de/?docid=00010942, IDN:980738539",Online-Ressource,"Silva, Márcio Rosa da [Verfasser]",Bioinformatics tools for the visualization and structural analysis of metabolic networks / von Márcio Rosa da Silva,,,,2006,Online-Ressource,,,,,,eng,,,"Braunschweig, Techn. Univ., Diss., 2006",,,,lizenzfrei,Biologie ; Biowissenschaften ; Datenverarbeitung ; Computerunterstütztes Verfahren,Erscheint auch als Márcio Rosa Silva da: Bioinformatics tools for the visualization and structural analysis of metabolic networks,,,"08,H07,1385"
550 Geowissenschaften,"URN:urn:nbn:de:swb:90-47304, URL:http://nbn-resolving.de/urn:nbn:de:swb:90-47304, URL:http://d-nb.info/1003496253/34, URL:http://digbib.ubka.uni-karlsruhe.de/volltexte/1000004730, IDN:1003496253",Online-Ressource,"Liesch, Tanja [Verfasser]",Ermittlung der Grundwassergefährdung mit Hilfe künstlicher neuronaler Netze / von Tanja Liesch,,,,2006,Online-Ressource,,,,,,ger,XA-DE,,"Karlsruhe, Univ., Diss., 2006",,,,lizenzfrei,Wasserverschmutzung ; Neuronales Netz ; Datenverarbeitung ; Computerunterstütztes Verfahren,Erscheint auch als Tanja Liesch: Ermittlung der Grundwassergefährdung mit Hilfe künstlicher neuronaler Netze,,,"94,P01"
"570 Biowissenschaften, Biologie ; 004 Informatik","URN:urn:nbn:de:0001-00367, URL:http://nbn-resolving.de/urn:nbn:de:0001-00367, URL:http://d-nb.info/981547656/34, URL:http://www.fz-juelich.de/nic-series/volume34/, ISBN:978-3-9810843-0-6, 3-9810843-0-6, IDN:981547656",Online-Ressource,"Meinke, Jan [Mitwirkender]","From computational biophysics to systems biology 2006 : NIC workshop 2006 ; Symposium, 06. - 09. June 2006, Forschungszentrum Jülich ; proceedings / John von Neumann Institute for Computing (NIC). Ed. by Jan Meinke ...",,,Jülich : NIC,2006,Online-Ressource,978-3-9810843-0-6,,,,,eng,,,,John von Neumann-Institut für Computing: NIC series : Verfasser ; Vol. 34,Inhaltsverzeichnis [http://d-nb.info/981547656/04],http://d-nb.info/986551945,lizenzfrei,Biologie ; Biowissenschaften ; Datenverarbeitung ; Computerunterstütztes Verfahren,Erscheint auch als: From computational biophysics to systems biology 2006 : 2006,,,"06,B48,0290"
"570 Biowissenschaften, Biologie ; 004 Informatik","URN:urn:nbn:de:0030-drops-4725, URL:http://nbn-resolving.de/urn:nbn:de:0030-drops-4725, URL:http://d-nb.info/988132990/34, URL:http://drops.dagstuhl.de/opus/volltexte/2006/472/pdf/04281_abstracts_collection.472.pdf, IDN:988132990",Online-Ressource,"Collado-Vides, Julio [Mitwirkender]",Integrative bioinformatics : aspects of the virtual cell ; 04281 abstracts collection ; Dagstuhl seminar / Julio Collado-Vides ...,,,[Wadern] : [Internat. Begegnungs- und Forschungszentrum für Informatik],2006,Online-Ressource,,,,,,eng,XA-DE,,,Dagstuhl seminar proceedings 04281,,,lizenzfrei,Biologie ; Biowissenschaften ; Datenverarbeitung ; Computerunterstütztes Verfahren,,,,"08,B48,0554"
620 Ingenieurwissenschaften und Maschinenbau ; 004 Informatik,"URN:urn:nbn:de:bsz:93-opus-29348, URL:http://nbn-resolving.de/urn:nbn:de:bsz:93-opus-29348, URL:http://d-nb.info/997046430/34, URL:http://elib.uni-stuttgart.de/opus/volltexte/2007/2934/pdf/Strobel.pdf, URL:http://elib.uni-stuttgart.de/opus/volltexte/2007/2934/, ISBN:978-3-8322-5712-5, 3-8322-5712-8, IDN:997046430",Online-Ressource,"Strobel, Thorsten [Verfasser]",Internetbasierte Datenintegration für Automatisierungssysteme / Thorsten Strobel,,[Online-Ausg.],Aachen : Shaker,2006,"XIII, 150 S. : Ill., graph. Darst. ; 21 cm, 254 gr.",978-3-8322-5712-5,,,,,ger,XA-DE-NW,,"Zugl.: Stuttgart, Univ., Diss., 2006","Universität Stuttgart / Institut für Automatisierungs- und Softwaretechnik: IAS-Forschungsberichte : Verfasser ; Bd. 2006,1",,http://d-nb.info/027187306,lizenzfrei,Automatisierungssystem ; Web Services ; Föderiertes System ; Datenintegration ; Systemplattform ; Zugriff,Online-Ausg.: [Stuttgart] : [Univ.-Biblitohek] [2007]. Online-Ressource,,,"10,O01"
"570 Biowissenschaften, Biologie","URN:urn:nbn:de:0030-drops-7061, URL:http://nbn-resolving.de/urn:nbn:de:0030-drops-7061, URL:http://d-nb.info/991214951/34, URL:http://drops.dagstuhl.de/opus/volltexte/2006/706/pdf/06161.CavaliereMatteo.ExtAbstract.706.pdf, IDN:991214951",Online-Ressource,"Cavaliere, Matteo [Mitwirkender] ; Sedwards, Sean [Mitwirkender]",Modeling and simulating biological processes with stochastic multiset rewriting / Matteo Cavaliere ...,,,[Wadern] : [Internat. Begegnungs- und Forschungszentrum für Informatik],2006,Online-Ressource,,,,,,eng,XA-DE,,,Dagstuhl seminar proceedings 06161,,,lizenzfrei,Biologie ; Biowissenschaften ; Datenverarbeitung ; Computerunterstütztes Verfahren,,,,"09,B04,0447"
"910 Geografie, Reisen ; 004 Informatik","URN:urn:nbn:de:bsz:93-opus-27850, URL:http://nbn-resolving.de/urn:nbn:de:bsz:93-opus-27850, URL:http://d-nb.info/981683770/34, URL:http://elib.uni-stuttgart.de/opus/volltexte/2006/2785/pdf/Dissertation_Volz.pdf, URL:http://elib.uni-stuttgart.de/opus/volltexte/2006/2785/, IDN:981683770",Online-Ressource,"Volz, Steffen [Verfasser]",Modellierung und Nutzung von Relationen zwischen Mehrfachrepräsentationen in Geo-Informationssystemen / vorgelegt von Steffen Volz,,,,2006,Online-Ressource,,,,,,,,,"Stuttgart, Univ., Diss., 2006",,,,lizenzfrei,Geoinformationssystem ; Geoinformationssystem ; Datenstruktur,,,,"07,H02,3979"
"570 Biowissenschaften, Biologie ; 510 Mathematik","URN:urn:nbn:de:bsz:25-opus-25729, URL:http://nbn-resolving.de/urn:nbn:de:bsz:25-opus-25729, URL:http://d-nb.info/980782597/34, URL:http://www.freidok.uni-freiburg.de/freidok/volltexte/2006/2572/pdf/diss.pdf, URL:http://www.freidok.uni-freiburg.de/volltexte/2572/index.html, IDN:980782597",Online-Ressource,"Lauer, Christian [Verfasser]",Muster und Alignments in zufälligen Zeichenketten / vorgelegt von Christian Lauer,,,,2006,Online-Ressource,,,,,,,,,"Freiburg (Breisgau), Univ., Diss., 2006",,,,lizenzfrei,Mustervergleich ; Alignment &lt;Biochemie> ; Zufällige Folge ; Stochastischer Prozess ; Poisson-Prozess ; Empirischer Prozess ; Molekulare Bioinformatik ; Biologie ; Biowissenschaften ; Datenverarbeitung ; Computerunterstütztes Verfahren,,,,"07,H04,1170"
004 Informatik,"URN:urn:nbn:de:swb:ch1-200601025, URL:http://nbn-resolving.de/urn:nbn:de:swb:ch1-200601025, URL:http://d-nb.info/1212513320/34, , IDN:1212513320",Online-Ressource,"Kratzert, Sebastian [Verfasser]","pyAXL2 - Eine Schnittstelle zur Verwaltung des ""Cisco Call Manager"" / Sebastian Kratzert",,,Chemnitz : Universitätsbibliothek Chemnitz; Chemnitz : Technische Universität Chemnitz,2006,Online-Ressource,,,,,,ger,XA-DE-SN,,,,,,lizenzfrei,Cisco ; Internettelefonie ; Python ; Python &lt;Programmiersprache> ; SOAP &lt;Protokoll>,,,,"20,O07"
